{
  "$schema": "https://json-schema.org/draft/2020-12/schema",
  "$id": "https://www.ybfstudio.com/schemas/portfolio.schema.json",
  "title": "YBF Portfolio Document",
  "type": "object",
  "additionalProperties": false,
  "required": [
    "schemaVersion",
    "contentVersion",
    "publishedAt",
    "flagshipOrder",
    "homepageOrder",
    "projects",
    "supportingWork",
    "redirects"
  ],
  "properties": {
    "schemaVersion": { "const": 1 },
    "contentVersion": { "type": "string", "minLength": 1 },
    "publishedAt": { "type": "string", "format": "date-time" },
    "flagshipOrder": { "type": "array", "uniqueItems": true, "items": { "$ref": "#/$defs/slug" } },
    "homepageOrder": { "type": "array", "uniqueItems": true, "items": { "$ref": "#/$defs/slug" } },
    "projects": { "type": "array", "items": { "$ref": "#/$defs/project" } },
    "supportingWork": { "type": "array", "items": { "$ref": "#/$defs/supporting" } },
    "redirects": {
      "type": "array",
      "items": {
        "type": "object",
        "additionalProperties": false,
        "required": ["from", "to", "permanent"],
        "properties": {
          "from": { "$ref": "#/$defs/slug" },
          "to": { "$ref": "#/$defs/slug" },
          "permanent": { "type": "boolean" }
        }
      }
    }
  },
  "$defs": {
    "slug": { "type": "string", "pattern": "^[a-z0-9]+(?:-[a-z0-9]+)*$" },
    "text": { "type": "string", "minLength": 1 },
    "project": {
      "type": "object",
      "required": [
        "slug", "title", "shortOutcome", "kind", "discipline", "status", "year", "role",
        "featured", "homepage", "tags", "accent", "ownership", "evidence", "links", "media", "narrative"
      ],
      "properties": {
        "slug": { "$ref": "#/$defs/slug" },
        "title": { "$ref": "#/$defs/text" },
        "shortOutcome": { "$ref": "#/$defs/text" },
        "kind": { "enum": ["ai", "operations", "product", "creative", "experiment"] },
        "discipline": { "$ref": "#/$defs/text" },
        "status": { "enum": ["active", "shipped", "experimental", "private", "in-development"] },
        "year": { "type": "integer", "minimum": 2000, "maximum": 2100 },
        "role": { "$ref": "#/$defs/text" },
        "featured": { "type": "boolean" },
        "homepage": { "type": "boolean" },
        "tags": { "type": "array", "items": { "$ref": "#/$defs/text" } },
        "accent": { "enum": ["signal", "warm", "sea", "studio"] },
        "ownership": { "type": "string", "minLength": 20 },
        "contentVersion": { "$ref": "#/$defs/text" },
        "sourceRepositories": { "type": "array", "items": { "type": "string", "pattern": "^[A-Za-z0-9_.-]+/[A-Za-z0-9_.-]+$" } },
        "lastVerifiedAt": { "type": "string", "format": "date-time" },
        "visibility": { "enum": ["published", "hidden"] },
        "repositoryMetadataPolicy": {
          "type": "object",
          "additionalProperties": false,
          "required": ["automaticFields", "approvedTopics"],
          "properties": {
            "automaticFields": {
              "type": "array",
              "uniqueItems": true,
              "items": {
                "enum": [
                  "repositoryMetadata.archived",
                  "repositoryMetadata.homepageUrl",
                  "repositoryMetadata.latestRelease",
                  "repositoryMetadata.primaryLanguage",
                  "repositoryMetadata.pushedAt",
                  "repositoryMetadata.repository",
                  "repositoryMetadata.topics",
                  "repositoryMetadata.url"
                ]
              }
            },
            "approvedTopics": { "type": "array", "uniqueItems": true, "items": { "$ref": "#/$defs/text" } }
          }
        },
        "repositoryMetadata": { "$ref": "#/$defs/repositoryMetadata" },
        "evidence": {
          "type": "array",
          "minItems": 1,
          "items": {
            "type": "object",
            "required": ["label", "value", "detail"],
            "properties": {
              "label": { "$ref": "#/$defs/text" },
              "value": { "$ref": "#/$defs/text" },
              "detail": { "$ref": "#/$defs/text" },
              "provenance": { "$ref": "#/$defs/text" },
              "sourceUrl": { "type": "string", "format": "uri" },
              "verifiedAt": { "type": "string", "format": "date-time" },
              "limitation": { "$ref": "#/$defs/text" },
              "basis": { "$ref": "#/$defs/evidenceBasis" }
            }
          }
        },
        "links": {
          "type": "array",
          "items": {
            "type": "object",
            "required": ["label", "href", "kind"],
            "properties": {
              "label": { "$ref": "#/$defs/text" },
              "href": { "type": "string", "format": "uri" },
              "kind": { "enum": ["live", "source", "detail", "release", "evidence", "demo"] }
            }
          }
        },
        "media": {
          "type": "array",
          "items": {
            "type": "object",
            "required": ["label", "src", "alt", "kind"],
            "properties": {
              "label": { "$ref": "#/$defs/text" },
              "src": { "type": "string", "format": "uri" },
              "alt": { "$ref": "#/$defs/text" },
              "kind": { "enum": ["image", "video", "audio"] },
              "integrity": { "type": "string", "pattern": "^sha256-[A-Za-z0-9+/=]+$" },
              "posterSrc": { "type": "string", "format": "uri" },
              "captionSrc": { "type": "string", "format": "uri" },
              "captionLanguage": { "type": "string", "pattern": "^[A-Za-z]{2,3}(?:-[A-Za-z0-9]{2,8})*$" },
              "captionLabel": { "$ref": "#/$defs/text" }
            },
            "dependentRequired": {
              "captionSrc": ["captionLanguage", "captionLabel"],
              "captionLanguage": ["captionSrc"],
              "captionLabel": ["captionSrc"]
            }
          }
        },
        "narrative": {
          "type": "object",
          "required": ["problem", "ownership", "systemMap", "decisions", "buildRecord", "failures", "currentStatus"],
          "properties": {
            "problem": { "$ref": "#/$defs/narrativeSection" },
            "ownership": { "$ref": "#/$defs/narrativeSection" },
            "systemMap": { "type": "array", "minItems": 5 },
            "decisions": { "type": "array", "minItems": 2 },
            "buildRecord": { "type": "array", "minItems": 3 },
            "failures": { "type": "array", "minItems": 2 },
            "currentStatus": { "$ref": "#/$defs/narrativeSection" }
          }
        }
      }
    },
    "evidenceBasis": {
      "type": "object",
      "additionalProperties": false,
      "required": ["studyClass", "sampleSize", "sampleUnit", "sourcePath", "sourceCommit", "generalizationBoundary"],
      "properties": {
        "studyClass": { "enum": ["promotion-benchmark", "exploratory-mini-spike", "prospective-paired-study"] },
        "sampleSize": { "type": "integer", "minimum": 1 },
        "sampleUnit": { "enum": ["paired-task", "task"] },
        "conditionRunCount": { "type": "integer", "minimum": 1 },
        "sourcePath": { "type": "string", "minLength": 1, "pattern": "^(?!/)(?!.*(?:^|/)\\.\\.(?:/|$))(?!.*\\\\).+$" },
        "sourceCommit": { "type": "string", "pattern": "^[0-9a-f]{40}$" },
        "generalizationBoundary": { "$ref": "#/$defs/text" }
      },
      "allOf": [
        {
          "if": { "properties": { "studyClass": { "enum": ["promotion-benchmark", "prospective-paired-study"] } }, "required": ["studyClass"] },
          "then": {
            "properties": {
              "sampleUnit": { "const": "paired-task" },
              "conditionRunCount": { "type": "integer", "minimum": 1 }
            },
            "required": ["conditionRunCount"]
          }
        },
        {
          "if": { "properties": { "studyClass": { "const": "exploratory-mini-spike" } }, "required": ["studyClass"] },
          "then": { "properties": { "sampleUnit": { "const": "task" } } }
        }
      ]
    },
    "narrativeSection": {
      "type": "object",
      "required": ["title", "body"],
      "properties": {
        "eyebrow": { "$ref": "#/$defs/text" },
        "title": { "$ref": "#/$defs/text" },
        "body": { "type": "array", "minItems": 1, "items": { "$ref": "#/$defs/text" } }
      }
    },
    "repositoryMetadata": {
      "type": "object",
      "additionalProperties": false,
      "required": ["repository", "url", "archived", "topics", "pushedAt"],
      "properties": {
        "repository": { "type": "string", "pattern": "^[A-Za-z0-9_.-]+/[A-Za-z0-9_.-]+$" },
        "url": { "type": "string", "format": "uri" },
        "homepageUrl": { "type": "string", "format": "uri" },
        "latestRelease": {
          "oneOf": [
            { "type": "null" },
            {
              "type": "object",
              "additionalProperties": false,
              "required": ["tag", "publishedAt", "url"],
              "properties": {
                "tag": { "$ref": "#/$defs/text" },
                "publishedAt": { "type": "string", "format": "date-time" },
                "url": { "type": "string", "format": "uri" }
              }
            }
          ]
        },
        "primaryLanguage": { "$ref": "#/$defs/text" },
        "topics": { "type": "array", "uniqueItems": true, "items": { "$ref": "#/$defs/text" } },
        "archived": { "type": "boolean" },
        "pushedAt": { "type": "string", "format": "date-time" }
      }
    },
    "supporting": {
      "type": "object",
      "additionalProperties": false,
      "required": ["slug", "title", "outcome", "kind", "status", "tags", "accent"],
      "properties": {
        "slug": { "$ref": "#/$defs/slug" },
        "title": { "$ref": "#/$defs/text" },
        "outcome": { "$ref": "#/$defs/text" },
        "kind": { "enum": ["ai", "operations", "product", "creative", "experiment"] },
        "status": { "enum": ["active", "shipped", "experimental", "private", "in-development"] },
        "tags": { "type": "array", "items": { "$ref": "#/$defs/text" } },
        "accent": { "enum": ["signal", "warm", "sea", "studio"] },
        "riskNote": { "$ref": "#/$defs/text" }
      }
    }
  }
}
