{
  "contentVersion": "2026-07-21.1",
  "flagshipOrder": [
    "la-studio-finder",
    "mighty-mouse",
    "tradeya"
  ],
  "homepageOrder": [
    "la-studio-finder",
    "mighty-mouse",
    "tradeya"
  ],
  "projects": [
    {
      "accent": "signal",
      "contentVersion": "2026-07-03.2",
      "discipline": "AI workflow reliability / developer tooling",
      "evidence": [
        {
          "basis": {
            "conditionRunCount": 20,
            "generalizationBoundary": "Ten paired tasks from the recorded projects, agent, models, and environment only; no generalized reliability or speed improvement was demonstrated.",
            "sampleSize": 10,
            "sampleUnit": "paired-task",
            "sourceCommit": "91f37272a49d0d05f4eee35228a1339d44594c70",
            "sourcePath": "data/evidence/real_project_report.md",
            "studyClass": "prospective-paired-study"
          },
          "detail": "Mighty Mouse and the control each passed six of ten paired real-project tasks on the first attempt, with zero scope violations in both conditions.",
          "label": "First-attempt passes",
          "limitation": "The study did not demonstrate better generalized first-pass reliability.",
          "provenance": "data/evidence/real_project_report.md — completed prospective study",
          "sourceUrl": "https://github.com/JOHNNYMACONNY/mighty-mouse/blob/91f37272a49d0d05f4eee35228a1339d44594c70/data/evidence/real_project_report.md",
          "value": "6/10 vs 6/10",
          "verifiedAt": "2026-07-03T18:25:37.000Z"
        },
        {
          "basis": {
            "conditionRunCount": 20,
            "generalizationBoundary": "Ten paired tasks from the recorded projects, agent, models, and environment only; no generalized reliability or speed improvement was demonstrated.",
            "sampleSize": 10,
            "sampleUnit": "paired-task",
            "sourceCommit": "91f37272a49d0d05f4eee35228a1339d44594c70",
            "sourcePath": "data/evidence/real_project_report.md",
            "studyClass": "prospective-paired-study"
          },
          "detail": "Mighty Mouse used four retry rounds across the sample; the control used six.",
          "label": "Retry rounds",
          "limitation": "Two fewer retries in this sample is not evidence of a universal improvement.",
          "provenance": "data/evidence/real_project_report.md — completed prospective study",
          "sourceUrl": "https://github.com/JOHNNYMACONNY/mighty-mouse/blob/91f37272a49d0d05f4eee35228a1339d44594c70/data/evidence/real_project_report.md",
          "value": "4 vs 6",
          "verifiedAt": "2026-07-03T18:25:37.000Z"
        },
        {
          "basis": {
            "conditionRunCount": 20,
            "generalizationBoundary": "Ten paired tasks from the recorded projects, agent, models, and environment only; no generalized reliability or speed improvement was demonstrated.",
            "sampleSize": 10,
            "sampleUnit": "paired-task",
            "sourceCommit": "91f37272a49d0d05f4eee35228a1339d44594c70",
            "sourcePath": "data/evidence/real_project_report.md",
            "studyClass": "prospective-paired-study"
          },
          "detail": "Mighty Mouse received a 4.60 mean blind-review score versus 4.30 for the control across the ten paired tasks.",
          "label": "Mean blind-review quality",
          "limitation": "The quality difference belongs to this sample and its recorded blind-review procedure.",
          "provenance": "data/evidence/real_project_report.md — completed prospective study",
          "sourceUrl": "https://github.com/JOHNNYMACONNY/mighty-mouse/blob/91f37272a49d0d05f4eee35228a1339d44594c70/data/evidence/real_project_report.md",
          "value": "4.60 vs 4.30",
          "verifiedAt": "2026-07-03T18:25:37.000Z"
        },
        {
          "basis": {
            "conditionRunCount": 20,
            "generalizationBoundary": "Ten paired tasks from the recorded projects, agent, models, and environment only; no generalized reliability or speed improvement was demonstrated.",
            "sampleSize": 10,
            "sampleUnit": "paired-task",
            "sourceCommit": "91f37272a49d0d05f4eee35228a1339d44594c70",
            "sourcePath": "data/evidence/real_project_report.md",
            "studyClass": "prospective-paired-study"
          },
          "detail": "Mighty Mouse was slower: 262.5 seconds median duration versus 229.5 seconds for the control; raw mean duration was also slower.",
          "label": "Median duration",
          "limitation": "The study did not demonstrate a generalized speed improvement.",
          "provenance": "data/evidence/real_project_report.md — completed prospective study",
          "sourceUrl": "https://github.com/JOHNNYMACONNY/mighty-mouse/blob/91f37272a49d0d05f4eee35228a1339d44594c70/data/evidence/real_project_report.md",
          "value": "262.5s vs 229.5s",
          "verifiedAt": "2026-07-03T18:25:37.000Z"
        },
        {
          "basis": {
            "conditionRunCount": 30,
            "generalizationBoundary": "Historical synthetic promotion suite and recorded environment only; the later prospective real-project study did not reproduce a generalized speed or first-pass reliability improvement.",
            "sampleSize": 15,
            "sampleUnit": "paired-task",
            "sourceCommit": "91f37272a49d0d05f4eee35228a1339d44594c70",
            "sourcePath": "data/evidence/results/PROMOTION_NOTES.md",
            "studyClass": "promotion-benchmark"
          },
          "detail": "Lean reduced average latency by 29.5% while both conditions passed 15 of 15 tasks in the historical synthetic promotion suite.",
          "label": "Historical synthetic latency result",
          "limitation": "This historical synthetic result is bounded to that suite and must not be generalized to real project work.",
          "provenance": "data/evidence/results/PROMOTION_NOTES.md — historical promotion validation",
          "sourceUrl": "https://github.com/JOHNNYMACONNY/mighty-mouse/blob/91f37272a49d0d05f4eee35228a1339d44594c70/data/evidence/results/PROMOTION_NOTES.md",
          "value": "29.5%",
          "verifiedAt": "2026-07-03T18:25:37.000Z"
        }
      ],
      "featured": true,
      "homepage": true,
      "kind": "ai",
      "lastVerifiedAt": "2026-07-03T18:25:37.000Z",
      "links": [
        {
          "href": "https://github.com/JOHNNYMACONNY/mighty-mouse",
          "kind": "source",
          "label": "Source repository"
        },
        {
          "href": "https://github.com/JOHNNYMACONNY/mighty-mouse/releases/tag/v0.2.1",
          "kind": "release",
          "label": "v0.2.1 release"
        },
        {
          "href": "https://github.com/JOHNNYMACONNY/mighty-mouse/blob/91f37272a49d0d05f4eee35228a1339d44594c70/data/evidence/real_project_report.md",
          "kind": "evidence",
          "label": "Real-project study report"
        },
        {
          "href": "https://github.com/JOHNNYMACONNY/mighty-mouse/blob/91f37272a49d0d05f4eee35228a1339d44594c70/data/evidence/platform_smoke_report.md",
          "kind": "evidence",
          "label": "Platform MCP smoke report"
        }
      ],
      "media": [
        {
          "alt": "Captioned Mighty Mouse workflow demo showing a real protocol response, disposable task scope, pytest verification, structured result, and explicit study limitations",
          "captionLabel": "English",
          "captionLanguage": "en",
          "captionSrc": "https://www.ybfstudio.com/work/mighty-mouse/mighty-mouse-demo.vtt",
          "integrity": "sha256-KNNEjcAsifFBa80CIieps+ynptcQvlYYY80CYkNmGKQ=",
          "kind": "video",
          "label": "An 80-second, captioned walkthrough uses real v0.2.1 CLI output and a disposable Python task to show the protocol-to-verification workflow without overstating the paired-study result.",
          "posterSrc": "https://www.ybfstudio.com/work/mighty-mouse/mighty-mouse-demo-poster.jpg",
          "src": "https://www.ybfstudio.com/work/mighty-mouse/mighty-mouse-demo.mp4"
        }
      ],
      "narrative": {
        "buildRecord": [
          {
            "detail": "Protocol and verify commands expose stable JSON interfaces alongside doctor, demo, and benchmark operations.",
            "label": "01 / INTERFACE",
            "title": "Core CLI"
          },
          {
            "detail": "A separate package exposes protocol and verification tools over stdio for compatible agent platforms.",
            "label": "02 / TRANSPORT",
            "title": "MCP server"
          },
          {
            "detail": "Core and MCP wheels and source distributions are built, archive-inspected, checksummed, and smoke-tested outside the checkout.",
            "label": "03 / DISTRIBUTE",
            "title": "Installable packages"
          },
          {
            "detail": "Python 3.10–3.13 CI, packaging gates, frozen trial manifests, and blind reviews keep implementation and claims auditable.",
            "label": "04 / VERIFY",
            "title": "CI and paired evaluation"
          }
        ],
        "currentStatus": {
          "body": [
            "Version 0.2.1 ships the core library, CLI, MCP transport, platform rules, verifier, CI matrix, release artifacts, and the completed ten-pair study. The current evidence supports fewer retries and higher mean blind-review quality in this sample, not a generalized first-pass reliability or speed improvement."
          ],
          "title": "Released reliability tooling with bounded evidence."
        },
        "decisions": [
          {
            "consequence": "A persuasive response cannot hide a failing project state.",
            "decision": "Return executable test, lint, build, and scope results instead of treating the agent’s explanation as completion evidence.",
            "title": "Use the project’s checks as the authority"
          },